{
  "contract_version": "validator-output-v1",
  "findings": [
    {
      "affected_features": [
        "margin"
      ],
      "evidence_ids": [
        "mk-ev-010-amazon-fees",
        "mk-ev-011-fda-importing-food",
        "mk-ev-012-fsvp",
        "mk-ev-013-fda-labeling"
      ],
      "finding_id": "finding-001",
      "recommended_action": "Obtain concrete landed cost quotes and verify breakage rates before market entry.",
      "severity": "high",
      "status": "open",
      "strongest_case": "No actual supplier quotes for landed cost components, unclear breakage rates, and payment processing fees reduce margin by 3% plus $0.30 per order, making margins unreliable.",
      "title": "Contribution margin highly uncertain due to unverified landed cost assumptions"
    }
  ],
  "product_family_id": "product-001",
  "role": "Validator",
  "status": "SUCCESS",
  "strongest_case_against_promotion": "Sensitivity scenarios rely on broad assumptions with no actual quotes, lack of demand data, and uncertain regulatory and cost components, preventing reliable viability assessment.",
  "unresolved": [
    "brandability",
    "competition_gap",
    "demand",
    "margin",
    "regulatory_risk",
    "repeat_purchase",
    "search_velocity",
    "shelf_stability",
    "shipping",
    "social_velocity",
    "supplier_depth"
  ],
  "verdict": "UNKNOWN"
}
